{
  "$schema": "../schemas/product.schema.json",
  "id": "org.fidan.Desktop",
  "name": "Project Fidan",
  "version": "0.1.0-alpha.1",
  "channel": "alpha",
  "supportUrl": "https://github.com/Taxperia/PiOS/issues",
  "githubRepo": "Taxperia/PiOS",
  "updateKeyring": "/etc/fidan/release-keyring.gpg",
  "accent": "#63DE87",
  "accentDark": "#2BA85B",
  "wallpaper": "/usr/share/backgrounds/fidan/fidan-mountain-dawn-4k.png"
}

